{"$schema":"https://json-schema.org/draft/2020-12/schema","$id":"https://god2.local/schemas/god2-semantic-event-v1.schema.json","title":"God2SemanticEvent v1 closed canonical writer profile","type":"object","additionalProperties":false,"required":["SchemaId","SchemaVersion","EventType","SemanticEventId","Sequence","Timestamp","ThreadId","ProcessId","SessionId","ClientBuildId","ModuleId","RVA","CallsiteRVA","SensitiveValue"],"properties":{"SchemaId":{"type":"string","const":"God2SemanticEvent"},"SchemaVersion":{"type":"integer","const":1},"EventType":{"enum":["PacketBoundary","ParserRead","SerializerWrite","HandlerInvocation","HandlerArgument","ObjectAllocated","ObjectDestroyed","ObjectResolved","ObjectLookup","RegistryLocated","RegistryEnumerated","ResourceRead","ResourceDecoded","ResourceDeserialized","StateMutation","TaintSeed","TaintPropagation","ValueFlow","FormulaOperand","FormulaResult","FunctionRoleCandidate","UIAnchor","SnapshotObject","SnapshotEdge","ProbeDiagnostic"]},"SemanticEventId":{"type":"string","minLength":1},"Sequence":{"type":"integer","minimum":0},"Timestamp":{"type":"string","minLength":1},"ThreadId":{"type":"integer","minimum":0},"ProcessId":{"type":"integer","minimum":1},"SessionId":{"type":"string","minLength":1},"ClientBuildId":{"type":"string","minLength":1},"ModuleId":{"type":"string","minLength":1},"RVA":{"type":"integer","minimum":0},"CallsiteRVA":{"type":"integer","minimum":0},"SensitiveValue":{"type":"boolean","const":false}}}
